[
  {
    "id": "rot-001",
    "rank": 1,
    "employeeName": "Morgan Price",
    "employeeCode": "CCD-301",
    "status": "eligible",
    "listType": "callback",
    "scenario": "Open OT Award",
    "seniorityDate": "2015-04-12",
    "equalizedOtHours": 18.5,
    "mandatesYtd": 1,
    "callbacksYtd": 3,
    "lastOffered": "2026-06-02",
    "qualifications": [
      "Dispatcher",
      "Police Radio",
      "NCIC"
    ],
    "recommendation": "Offer first: lowest equalized OT among qualified dispatchers.",
    "skipReason": ""
  },
  {
    "id": "rot-002",
    "rank": 2,
    "employeeName": "Avery Collins",
    "employeeCode": "CCD-217",
    "status": "eligible",
    "listType": "callback",
    "scenario": "Open OT Award",
    "seniorityDate": "2012-09-30",
    "equalizedOtHours": 22,
    "mandatesYtd": 0,
    "callbacksYtd": 4,
    "lastOffered": "2026-06-01",
    "qualifications": [
      "Dispatcher",
      "Calltaking"
    ],
    "recommendation": "Eligible but behind lower equalized OT employee.",
    "skipReason": ""
  },
  {
    "id": "rot-003",
    "rank": 3,
    "employeeName": "Jordan Hayes",
    "employeeCode": "CCD-144",
    "status": "skipped",
    "listType": "callback",
    "scenario": "Open OT Award",
    "seniorityDate": "2010-01-18",
    "equalizedOtHours": 16,
    "mandatesYtd": 2,
    "callbacksYtd": 2,
    "lastOffered": "2026-05-29",
    "qualifications": [
      "Calltaking"
    ],
    "recommendation": "Skip for this opportunity unless admin overrides.",
    "skipReason": "Missing required Police Radio qualification"
  },
  {
    "id": "rot-004",
    "rank": 4,
    "employeeName": "Taylor Reed",
    "employeeCode": "CCD-088",
    "status": "mandate",
    "listType": "mandate",
    "scenario": "Mandation",
    "seniorityDate": "2008-07-06",
    "equalizedOtHours": 31,
    "mandatesYtd": 0,
    "callbacksYtd": 6,
    "lastOffered": "2026-06-07",
    "qualifications": [
      "Dispatcher",
      "Police Radio",
      "Training Officer"
    ],
    "recommendation": "Mandate candidate only if voluntary list is exhausted.",
    "skipReason": ""
  },
  {
    "id": "rot-005",
    "rank": 5,
    "employeeName": "Casey Miller",
    "employeeCode": "CCD-333",
    "status": "skipped",
    "listType": "mandate",
    "scenario": "Mandation",
    "seniorityDate": "2020-03-14",
    "equalizedOtHours": 8,
    "mandatesYtd": 0,
    "callbacksYtd": 1,
    "lastOffered": "2026-06-04",
    "qualifications": [
      "Dispatcher",
      "Police Radio"
    ],
    "recommendation": "Not available for mandate in preview.",
    "skipReason": "Admin exception: FMLA / no mandate"
  }
]